{
  "name": "CMU Cal",
  "slug": "cmucal",
  "description": "CMUCal eliminates the friction of managing scattered academic schedules by bringing all CMU academic resources into one place. - Through seamless Google Calendar integration, it unifies users' existing calendars with lectures, recitations, office hours, and academic support events. - Planned features include integrations with Handshake and TartanConnect, as well as community-driven event discovery through crowdsourced submissions and upvote/downvote mechanisms. Please follow the contributing-guide linked below if you are interested in joining!",
  "maintainers": [
    "qianxuege"
  ],
  "contributors": [
    "qianxuege",
    "HeidiTao",
    "AliceeLe",
    "chenalex1"
  ],
  "repos": [
    "cmucal",
    "cmucal-backend"
  ],
  "sync_github": false,
  "sync_forgejo": false,
  "remove_unlisted": false,
  "slack_channels": [
    "C05TNBPHVTL"
  ]
}
